{"schemaVersion":"public-1.0","catalogVersion":"2026-10-14-internal-r1","configuration":{"asOfDate":"2026-10-14","historicalPeriod":{"startDate":"2019-07-01","endDate":"2026-09-15"}},"option":{"optionKey":"o185","permitTypeKey":"t038","permitType":"PRCR - Urban Forestry","workClassKey":"w115","workClass":"Tree Impact Permit"},"ui":{"controls":[{"key":"i001","label":"Impact Type","displayLabel":"Impact Type","valueType":"choice","controlType":"select","displayReady":true,"usages":["applicability"],"requiredForFeeIds":["f0002","f0001"],"choices":[{"value":"c001","label":"Development"},{"value":"c002","label":"Non-Development"}],"historicalPrevalence":{"status":"unavailable"},"presentationGroup":null,"choiceContextStatus":"available"}],"presentation":{"mode":"flat","groups":[]},"uiBlockers":[],"blockingRuntimeDiagnostics":[],"runtimeReady":true,"displayReady":true},"fees":[{"feeTemplateFeeId":"f0001","name":"PRCR - Tree Impact Permit (Development)","section":"conditional","assessmentRole":"standalone-or-assessed","applicability":{"status":"conditional","conditions":[{"kind":"expression","sourceRule":{"isOrGroup":false,"childConditions":[{"operatorID":1,"operandValue":"i001","compareExpression":{"value":"c001"}}],"childConditionGroups":[]}}]},"calculation":{"mode":"fixed","fixedAmount":126.0,"rule":{"amount":126.0,"minimum":0.0,"maximum":0.0,"roundingType":1,"roundingValue":0.0,"inputs":[]}}},{"feeTemplateFeeId":"f0002","name":"PRCR - Tree Impact Permit (Non-Development)","section":"conditional","assessmentRole":"standalone-or-assessed","applicability":{"status":"conditional","conditions":[{"kind":"expression","sourceRule":{"isOrGroup":false,"childConditions":[{"operatorID":1,"operandValue":"i001","compareExpression":{"value":"c002"}}],"childConditionGroups":[]}}]},"calculation":{"mode":"fixed","fixedAmount":126.0,"rule":{"amount":126.0,"minimum":0.0,"maximum":0.0,"roundingType":1,"roundingValue":0.0,"inputs":[]}}},{"feeTemplateFeeId":"f0003","name":"MISC - Technology Surcharge","section":"inactive","assessmentRole":"standalone-or-assessed","applicability":{"status":"inactive","conditions":[]},"calculation":{"mode":"unsupported","fixedAmount":null,"rule":{"amount":4.0,"minimum":0.0,"maximum":0.0,"roundingType":2,"roundingValue":1.0,"inputs":[],"publicBehavior":{"rateScale":0.01}}}},{"feeTemplateFeeId":"f0004","name":"MISC - Technology Surcharge","section":"input-required","assessmentRole":"standalone-or-assessed","applicability":{"status":"configured","conditions":[]},"calculation":{"mode":"input","fixedAmount":null,"rule":{"amount":4.0,"minimum":0.0,"maximum":0.0,"roundingType":2,"roundingValue":1.0,"inputs":[{"source":"fee","inputKey":"f0005"},{"source":"fee","inputKey":"f0006"},{"source":"fee","inputKey":"f0007"},{"source":"fee","inputKey":"f0009"},{"source":"fee","inputKey":"f0008"},{"source":"fee","inputKey":"f0019"},{"source":"fee","inputKey":"f0020"}],"publicBehavior":{"rateScale":0.01,"aggregate":"sum"}}}},{"feeTemplateFeeId":"f0005","name":"DSENG - Voiding Permit Fee - Engineering (ROW)","section":"manual-review","assessmentRole":"dependency-unresolved","applicability":{"status":"manual-review","conditions":[]},"calculation":{"mode":"manual","fixedAmount":null,"rule":{"amount":124.0,"minimum":0.0,"maximum":0.0,"roundingType":1,"roundingValue":0.0,"inputs":[]}},"disposition":"later-event"},{"feeTemplateFeeId":"f0006","name":"DSINSP - Voiding Permit Fee - Building","section":"manual-review","assessmentRole":"dependency-unresolved","applicability":{"status":"manual-review","conditions":[]},"calculation":{"mode":"manual","fixedAmount":null,"rule":{"amount":124.0,"minimum":0.0,"maximum":0.0,"roundingType":1,"roundingValue":0.0,"inputs":[]}},"disposition":"later-event"},{"feeTemplateFeeId":"f0007","name":"DSINSP - Voiding Permit Fee - Electrical","section":"manual-review","assessmentRole":"dependency-unresolved","applicability":{"status":"manual-review","conditions":[]},"calculation":{"mode":"manual","fixedAmount":null,"rule":{"amount":124.0,"minimum":0.0,"maximum":0.0,"roundingType":1,"roundingValue":0.0,"inputs":[]}},"disposition":"later-event"},{"feeTemplateFeeId":"f0008","name":"DSINSP - Voiding Permit Fee - Plumbing","section":"manual-review","assessmentRole":"dependency-unresolved","applicability":{"status":"manual-review","conditions":[]},"calculation":{"mode":"manual","fixedAmount":null,"rule":{"amount":124.0,"minimum":0.0,"maximum":0.0,"roundingType":1,"roundingValue":0.0,"inputs":[]}},"disposition":"later-event"},{"feeTemplateFeeId":"f0009","name":"DSINSP - Voiding Permit Fee – Mechanical","section":"manual-review","assessmentRole":"dependency-unresolved","applicability":{"status":"manual-review","conditions":[]},"calculation":{"mode":"manual","fixedAmount":null,"rule":{"amount":124.0,"minimum":0.0,"maximum":0.0,"roundingType":1,"roundingValue":0.0,"inputs":[]}},"disposition":"later-event"},{"feeTemplateFeeId":"f0010","name":"ENG - Voiding Permit Fee - Stormwater","section":"manual-review","assessmentRole":"standalone-or-assessed","applicability":{"status":"manual-review","conditions":[]},"calculation":{"mode":"manual","fixedAmount":null,"rule":{"amount":124.0,"minimum":0.0,"maximum":0.0,"roundingType":1,"roundingValue":0.0,"inputs":[]}},"disposition":"later-event"},{"feeTemplateFeeId":"f0011","name":"FIRE - Voiding Permit Fee - Fire Alarm","section":"manual-review","assessmentRole":"standalone-or-assessed","applicability":{"status":"manual-review","conditions":[]},"calculation":{"mode":"manual","fixedAmount":null,"rule":{"amount":124.0,"minimum":0.0,"maximum":0.0,"roundingType":1,"roundingValue":0.0,"inputs":[]}},"disposition":"later-event"},{"feeTemplateFeeId":"f0012","name":"FIRE - Voiding Permit Fee - Fire Protection","section":"manual-review","assessmentRole":"standalone-or-assessed","applicability":{"status":"manual-review","conditions":[]},"calculation":{"mode":"manual","fixedAmount":null,"rule":{"amount":124.0,"minimum":0.0,"maximum":0.0,"roundingType":1,"roundingValue":0.0,"inputs":[]}},"disposition":"later-event"},{"feeTemplateFeeId":"f0013","name":"MISC - Technology Surcharge","section":"manual-review","assessmentRole":"standalone-or-assessed","applicability":{"status":"manual-review","conditions":[]},"calculation":{"mode":"manual","fixedAmount":null,"rule":{"amount":4.0,"minimum":0.0,"maximum":0.0,"roundingType":2,"roundingValue":1.0,"inputs":[],"publicBehavior":{"rateScale":0.01}}}},{"feeTemplateFeeId":"f0014","name":"PRCR - Tree Replacement Fee","section":"manual-review","assessmentRole":"standalone-or-assessed","applicability":{"status":"manual-review","conditions":[]},"calculation":{"mode":"manual","fixedAmount":null,"rule":{"amount":1.0,"minimum":0.0,"maximum":0.0,"roundingType":1,"roundingValue":0.0,"inputs":[]}}},{"feeTemplateFeeId":"f0015","name":"PRCR - Urban Forestry Inspection Fee","section":"manual-review","assessmentRole":"standalone-or-assessed","applicability":{"status":"manual-review","conditions":[]},"calculation":{"mode":"manual","fixedAmount":null,"rule":{"amount":1.0,"minimum":0.0,"maximum":0.0,"roundingType":1,"roundingValue":0.0,"inputs":[]}}},{"feeTemplateFeeId":"f0016","name":"PRCR - Voiding Permit Fee - Urban Forestry","section":"manual-review","assessmentRole":"standalone-or-assessed","applicability":{"status":"manual-review","conditions":[]},"calculation":{"mode":"manual","fixedAmount":null,"rule":{"amount":124.0,"minimum":0.0,"maximum":0.0,"roundingType":1,"roundingValue":0.0,"inputs":[]}},"disposition":"later-event"},{"feeTemplateFeeId":"f0017","name":"PU - Voiding Permit Fee - Stub","section":"manual-review","assessmentRole":"standalone-or-assessed","applicability":{"status":"manual-review","conditions":[]},"calculation":{"mode":"manual","fixedAmount":null,"rule":{"amount":124.0,"minimum":0.0,"maximum":0.0,"roundingType":1,"roundingValue":0.0,"inputs":[]}},"disposition":"later-event"},{"feeTemplateFeeId":"f0018","name":"UF - Urban Forestry Reinspection Fee","section":"manual-review","assessmentRole":"standalone-or-assessed","applicability":{"status":"manual-review","conditions":[]},"calculation":{"mode":"manual","fixedAmount":null,"rule":{"amount":122.0,"minimum":0.0,"maximum":0.0,"roundingType":1,"roundingValue":0.0,"inputs":[]}},"disposition":"later-event"},{"feeTemplateFeeId":"f0019","name":"ZP - Voiding Permit Fee - Zoning","section":"manual-review","assessmentRole":"dependency-unresolved","applicability":{"status":"manual-review","conditions":[]},"calculation":{"mode":"manual","fixedAmount":null,"rule":{"amount":124.0,"minimum":0.0,"maximum":0.0,"roundingType":1,"roundingValue":0.0,"inputs":[]}},"disposition":"later-event"},{"feeTemplateFeeId":"f0020","name":"ZP- Voiding Permit Fee (Zoning - Sign)","section":"manual-review","assessmentRole":"dependency-unresolved","applicability":{"status":"manual-review","conditions":[]},"calculation":{"mode":"manual","fixedAmount":null,"rule":{"amount":124.0,"minimum":0.0,"maximum":0.0,"roundingType":1,"roundingValue":0.0,"inputs":[]}},"disposition":"later-event"}],"relatedPermits":[],"disclosures":[{"code":"CONFIGURATION_AS_OF_DATE"},{"code":"ENERGOV_SOURCE_OF_TRUTH"},{"code":"ESTIMATE_NOT_INVOICE"},{"code":"INPUT_REQUIRED"},{"code":"MANUAL_REVIEW"},{"code":"REPEATABLE_FEE"},{"code":"UNSUPPORTED_RULE"}]}
