{"schemaVersion":"public-1.0","catalogVersion":"2026-10-14-field-history","configuration":{"asOfDate":"2026-10-14","historicalPeriod":{"startDate":"2019-07-01","endDate":"2026-09-15"}},"option":{"optionKey":"o149","permitTypeKey":"t027","permitType":"DSLC - Zoning Permit","workClassKey":"w086","workClass":"Zoning Change of Use"},"ui":{"controls":[],"presentation":{"mode":"flat","groups":[]},"uiBlockers":[],"blockingRuntimeDiagnostics":[],"runtimeReady":true,"displayReady":true},"fees":[{"feeTemplateFeeId":"f0001","name":"DSINSP - Non-Residential Zoning Permit","section":"configured","assessmentRole":"dependency-and-assessed","applicability":{"status":"configured","conditions":[]},"calculation":{"mode":"fixed","fixedAmount":278.0,"rule":{"amount":278.0,"minimum":0.0,"maximum":0.0,"roundingType":1,"roundingValue":0.0,"inputs":[]}}},{"feeTemplateFeeId":"f0002","name":"MISC - Technology Surcharge","section":"input-required","assessmentRole":"standalone-or-assessed","applicability":{"status":"configured","conditions":[]},"calculation":{"mode":"input","fixedAmount":null,"rule":{"amount":4.0,"minimum":0.0,"maximum":0.0,"roundingType":2,"roundingValue":1.0,"inputs":[{"source":"fee","inputKey":"f0001"}],"publicBehavior":{"rateScale":0.01}}}},{"feeTemplateFeeId":"f0003","name":"DSINSP - Residential Zoning Fee","section":"manual-review","assessmentRole":"dependency-unresolved","applicability":{"status":"manual-review","conditions":[]},"calculation":{"mode":"manual","fixedAmount":null,"rule":{"amount":261.0,"minimum":0.0,"maximum":0.0,"roundingType":1,"roundingValue":0.0,"inputs":[]}}},{"feeTemplateFeeId":"f0004","name":"MISC - Technology Surcharge","section":"manual-review","assessmentRole":"standalone-or-assessed","applicability":{"status":"manual-review","conditions":[]},"calculation":{"mode":"manual","fixedAmount":null,"rule":{"amount":4.0,"minimum":0.0,"maximum":0.0,"roundingType":2,"roundingValue":1.0,"inputs":[{"source":"fee","inputKey":"f0003"}],"publicBehavior":{"rateScale":0.01}}}}],"relatedPermits":[],"disclosures":[{"code":"CONFIGURATION_AS_OF_DATE"},{"code":"ENERGOV_SOURCE_OF_TRUTH"},{"code":"ESTIMATE_NOT_INVOICE"},{"code":"HISTORICAL_OCCURRENCE_NOT_REQUIREMENT"},{"code":"INPUT_REQUIRED"},{"code":"MANUAL_REVIEW"}]}
