{"schemaVersion":"public-1.0","catalogVersion":"2026-10-14-internal-r1","configuration":{"asOfDate":"2026-10-14","historicalPeriod":{"startDate":"2019-07-01","endDate":"2026-09-15"}},"option":{"optionKey":"o129","permitTypeKey":"t027","permitType":"DSLC - Zoning Permit","workClassKey":"w066","workClass":"ABC"},"ui":{"controls":[],"presentation":{"mode":"flat","groups":[]},"uiBlockers":[],"blockingRuntimeDiagnostics":[],"runtimeReady":true,"displayReady":true},"fees":[{"feeTemplateFeeId":"f0001","name":"ZP - Building Permit Fee","section":"configured","assessmentRole":"dependency-and-assessed","applicability":{"status":"configured","conditions":[]},"calculation":{"mode":"fixed","fixedAmount":124.0,"rule":{"amount":124.0,"minimum":0.0,"maximum":0.0,"roundingType":1,"roundingValue":0.0,"inputs":[]}}},{"feeTemplateFeeId":"f0002","name":"ZP - Fire Permit Fee","section":"configured","assessmentRole":"standalone-or-assessed","applicability":{"status":"configured","conditions":[]},"calculation":{"mode":"fixed","fixedAmount":124.0,"rule":{"amount":124.0,"minimum":0.0,"maximum":0.0,"roundingType":1,"roundingValue":0.0,"inputs":[]}}},{"feeTemplateFeeId":"f0003","name":"ZP - Zoning Permit Fee","section":"configured","assessmentRole":"dependency-and-assessed","applicability":{"status":"configured","conditions":[]},"calculation":{"mode":"fixed","fixedAmount":124.0,"rule":{"amount":124.0,"minimum":0.0,"maximum":0.0,"roundingType":1,"roundingValue":0.0,"inputs":[]}}},{"feeTemplateFeeId":"f0004","name":"FIRE - Reinspection Fee","section":"event-contingent","assessmentRole":"dependency-and-assessed","applicability":{"status":"event-contingent","conditions":[{"kind":"expression","sourceRule":{"isOrGroup":false,"childConditions":[{"operatorID":1,"operandValue":"x001","compareExpression":{"value":"c001"}}],"childConditionGroups":[]}},{"kind":"inspection"}]},"calculation":{"mode":"fixed","fixedAmount":122.0,"rule":{"amount":122.0,"minimum":0.0,"maximum":0.0,"roundingType":1,"roundingValue":0.0,"inputs":[]}},"disposition":"later-event"},{"feeTemplateFeeId":"f0005","name":"MISC - Technology Surcharge","section":"inactive","assessmentRole":"standalone-or-assessed","applicability":{"status":"inactive","conditions":[{"kind":"inspection"}]},"calculation":{"mode":"unsupported","fixedAmount":null,"rule":{"amount":4.0,"minimum":0.0,"maximum":0.0,"roundingType":2,"roundingValue":1.0,"inputs":[{"source":"fee","inputKey":"u0001"},{"source":"fee","inputKey":"f0004"}],"publicBehavior":{"rateScale":0.01,"aggregate":"sum"}}}},{"feeTemplateFeeId":"f0006","name":"MISC - Technology Surcharge","section":"inactive","assessmentRole":"standalone-or-assessed","applicability":{"status":"inactive","conditions":[]},"calculation":{"mode":"unsupported","fixedAmount":null,"rule":{"amount":4.0,"minimum":0.0,"maximum":0.0,"roundingType":2,"roundingValue":1.0,"inputs":[],"publicBehavior":{"rateScale":0.01}}}},{"feeTemplateFeeId":"f0007","name":"MISC - Technology Surcharge","section":"input-required","assessmentRole":"standalone-or-assessed","applicability":{"status":"configured","conditions":[]},"calculation":{"mode":"input","fixedAmount":null,"rule":{"amount":4.0,"minimum":0.0,"maximum":0.0,"roundingType":2,"roundingValue":1.0,"inputs":[{"source":"fee","inputKey":"f0009"},{"source":"fee","inputKey":"f0010"},{"source":"fee","inputKey":"f0011"},{"source":"fee","inputKey":"f0013"},{"source":"fee","inputKey":"f0012"},{"source":"fee","inputKey":"f0019"},{"source":"fee","inputKey":"f0020"}],"publicBehavior":{"rateScale":0.01,"aggregate":"sum"}}}},{"feeTemplateFeeId":"f0008","name":"MISC - Technology Surcharge","section":"input-required","assessmentRole":"standalone-or-assessed","applicability":{"status":"configured","conditions":[]},"calculation":{"mode":"input","fixedAmount":null,"rule":{"amount":4.0,"minimum":0.0,"maximum":0.0,"roundingType":2,"roundingValue":1.0,"inputs":[{"source":"fee","inputKey":"f0001"},{"source":"fee","inputKey":"f0003"}],"publicBehavior":{"rateScale":0.01,"aggregate":"sum"}}}},{"feeTemplateFeeId":"f0009","name":"DSENG - Voiding Permit Fee - Engineering (ROW)","section":"manual-review","assessmentRole":"dependency-unresolved","applicability":{"status":"manual-review","conditions":[]},"calculation":{"mode":"manual","fixedAmount":null,"rule":{"amount":124.0,"minimum":0.0,"maximum":0.0,"roundingType":1,"roundingValue":0.0,"inputs":[]}},"disposition":"later-event"},{"feeTemplateFeeId":"f0010","name":"DSINSP - Voiding Permit Fee - Building","section":"manual-review","assessmentRole":"dependency-unresolved","applicability":{"status":"manual-review","conditions":[]},"calculation":{"mode":"manual","fixedAmount":null,"rule":{"amount":124.0,"minimum":0.0,"maximum":0.0,"roundingType":1,"roundingValue":0.0,"inputs":[]}},"disposition":"later-event"},{"feeTemplateFeeId":"f0011","name":"DSINSP - Voiding Permit Fee - Electrical","section":"manual-review","assessmentRole":"dependency-unresolved","applicability":{"status":"manual-review","conditions":[]},"calculation":{"mode":"manual","fixedAmount":null,"rule":{"amount":124.0,"minimum":0.0,"maximum":0.0,"roundingType":1,"roundingValue":0.0,"inputs":[]}},"disposition":"later-event"},{"feeTemplateFeeId":"f0012","name":"DSINSP - Voiding Permit Fee - Plumbing","section":"manual-review","assessmentRole":"dependency-unresolved","applicability":{"status":"manual-review","conditions":[]},"calculation":{"mode":"manual","fixedAmount":null,"rule":{"amount":124.0,"minimum":0.0,"maximum":0.0,"roundingType":1,"roundingValue":0.0,"inputs":[]}},"disposition":"later-event"},{"feeTemplateFeeId":"f0013","name":"DSINSP - Voiding Permit Fee – Mechanical","section":"manual-review","assessmentRole":"dependency-unresolved","applicability":{"status":"manual-review","conditions":[]},"calculation":{"mode":"manual","fixedAmount":null,"rule":{"amount":124.0,"minimum":0.0,"maximum":0.0,"roundingType":1,"roundingValue":0.0,"inputs":[]}},"disposition":"later-event"},{"feeTemplateFeeId":"f0014","name":"ENG - Voiding Permit Fee - Stormwater","section":"manual-review","assessmentRole":"standalone-or-assessed","applicability":{"status":"manual-review","conditions":[]},"calculation":{"mode":"manual","fixedAmount":null,"rule":{"amount":124.0,"minimum":0.0,"maximum":0.0,"roundingType":1,"roundingValue":0.0,"inputs":[]}},"disposition":"later-event"},{"feeTemplateFeeId":"f0015","name":"FIRE - Voiding Permit Fee - Fire Alarm","section":"manual-review","assessmentRole":"standalone-or-assessed","applicability":{"status":"manual-review","conditions":[]},"calculation":{"mode":"manual","fixedAmount":null,"rule":{"amount":124.0,"minimum":0.0,"maximum":0.0,"roundingType":1,"roundingValue":0.0,"inputs":[]}},"disposition":"later-event"},{"feeTemplateFeeId":"f0016","name":"FIRE - Voiding Permit Fee - Fire Protection","section":"manual-review","assessmentRole":"standalone-or-assessed","applicability":{"status":"manual-review","conditions":[]},"calculation":{"mode":"manual","fixedAmount":null,"rule":{"amount":124.0,"minimum":0.0,"maximum":0.0,"roundingType":1,"roundingValue":0.0,"inputs":[]}},"disposition":"later-event"},{"feeTemplateFeeId":"f0017","name":"PRCR - Voiding Permit Fee - Urban Forestry","section":"manual-review","assessmentRole":"standalone-or-assessed","applicability":{"status":"manual-review","conditions":[]},"calculation":{"mode":"manual","fixedAmount":null,"rule":{"amount":124.0,"minimum":0.0,"maximum":0.0,"roundingType":1,"roundingValue":0.0,"inputs":[]}},"disposition":"later-event"},{"feeTemplateFeeId":"f0018","name":"PU - Voiding Permit Fee - Stub","section":"manual-review","assessmentRole":"standalone-or-assessed","applicability":{"status":"manual-review","conditions":[]},"calculation":{"mode":"manual","fixedAmount":null,"rule":{"amount":124.0,"minimum":0.0,"maximum":0.0,"roundingType":1,"roundingValue":0.0,"inputs":[]}},"disposition":"later-event"},{"feeTemplateFeeId":"f0019","name":"ZP - Voiding Permit Fee - Zoning","section":"manual-review","assessmentRole":"dependency-unresolved","applicability":{"status":"manual-review","conditions":[]},"calculation":{"mode":"manual","fixedAmount":null,"rule":{"amount":124.0,"minimum":0.0,"maximum":0.0,"roundingType":1,"roundingValue":0.0,"inputs":[]}},"disposition":"later-event"},{"feeTemplateFeeId":"f0020","name":"ZP- Voiding Permit Fee (Zoning - Sign)","section":"manual-review","assessmentRole":"dependency-unresolved","applicability":{"status":"manual-review","conditions":[]},"calculation":{"mode":"manual","fixedAmount":null,"rule":{"amount":124.0,"minimum":0.0,"maximum":0.0,"roundingType":1,"roundingValue":0.0,"inputs":[]}},"disposition":"later-event"}],"relatedPermits":[],"disclosures":[{"code":"CONFIGURATION_AS_OF_DATE"},{"code":"ENERGOV_SOURCE_OF_TRUTH"},{"code":"ESTIMATE_NOT_INVOICE"},{"code":"EVENT_CONTINGENT"},{"code":"HISTORICAL_OCCURRENCE_NOT_REQUIREMENT"},{"code":"INPUT_REQUIRED"},{"code":"MANUAL_REVIEW"},{"code":"REPEATABLE_FEE"},{"code":"UNSUPPORTED_RULE"}]}
