{"schemaVersion":"public-1.0","catalogVersion":"2026-10-14-internal-r1","configuration":{"asOfDate":"2026-10-14","historicalPeriod":{"startDate":"2019-07-01","endDate":"2026-09-15"}},"option":{"optionKey":"o044","permitTypeKey":"t006","permitType":"DSINSP - Certificate of Occupancy","workClassKey":"w035","workClass":"Certificate of Occupancy - Non-Residential"},"ui":{"controls":[],"presentation":{"mode":"flat","groups":[]},"uiBlockers":[],"blockingRuntimeDiagnostics":[],"runtimeReady":true,"displayReady":true},"fees":[{"feeTemplateFeeId":"f0001","name":"DSINSP - Partial Certificate of Occupancy Fee","section":"conditional","assessmentRole":"dependency-unresolved","applicability":{"status":"conditional","conditions":[{"kind":"expression","sourceRule":{"isOrGroup":false,"childConditions":[{"operatorID":1,"operandValue":"selected-work-class","systemField":"selected-work-class","compareExpression":{"value":"w035"}}],"childConditionGroups":[]}}]},"calculation":{"mode":"fixed","fixedAmount":313.0,"rule":{"amount":313.0,"minimum":0.0,"maximum":0.0,"roundingType":1,"roundingValue":0.0,"inputs":[]}}},{"feeTemplateFeeId":"f0002","name":"MISC - Technology Surcharge","section":"input-required","assessmentRole":"standalone-or-assessed","applicability":{"status":"configured","conditions":[]},"calculation":{"mode":"input","fixedAmount":null,"rule":{"amount":4.0,"minimum":0.0,"maximum":0.0,"roundingType":2,"roundingValue":1.0,"inputs":[{"source":"fee","inputKey":"f0001"},{"source":"fee","inputKey":"f0005"}],"publicBehavior":{"rateScale":0.01,"aggregate":"sum"}}}},{"feeTemplateFeeId":"f0003","name":"DSINSP - Building Inspection Fee","section":"manual-review","assessmentRole":"standalone-or-assessed","applicability":{"status":"manual-review","conditions":[]},"calculation":{"mode":"manual","fixedAmount":null,"rule":{"amount":1.0,"minimum":0.0,"maximum":0.0,"roundingType":1,"roundingValue":0.0,"inputs":[]}}},{"feeTemplateFeeId":"f0004","name":"DSINSP - Partial Certificate of Occupancy Fee","section":"manual-review","assessmentRole":"dependency-unresolved","applicability":{"status":"manual-review","conditions":[]},"calculation":{"mode":"manual","fixedAmount":null,"rule":{"amount":313.0,"minimum":0.0,"maximum":0.0,"roundingType":1,"roundingValue":0.0,"inputs":[]}}},{"feeTemplateFeeId":"f0005","name":"DSINSP - Temporary Certificate of Occupancy Fee","section":"manual-review","assessmentRole":"dependency-and-assessed","applicability":{"status":"manual-review","conditions":[{"kind":"expression","sourceRule":{"isOrGroup":true,"childConditions":[{"operatorID":1,"operandValue":"selected-work-class","systemField":"selected-work-class","compareExpression":{"value":"w035"}}],"childConditionGroups":[]}}]},"calculation":{"mode":"manual","fixedAmount":null,"rule":{"amount":1057.0,"minimum":0.0,"maximum":0.0,"roundingType":1,"roundingValue":0.0,"inputs":[]}}},{"feeTemplateFeeId":"f0006","name":"MISC - Technology Surcharge","section":"manual-review","assessmentRole":"standalone-or-assessed","applicability":{"status":"manual-review","conditions":[]},"calculation":{"mode":"manual","fixedAmount":null,"rule":{"amount":4.0,"minimum":0.0,"maximum":0.0,"roundingType":2,"roundingValue":1.0,"inputs":[{"source":"fee","inputKey":"f0001"},{"source":"fee","inputKey":"f0004"},{"source":"fee","inputKey":"f0005"}],"publicBehavior":{"rateScale":0.01,"aggregate":"sum"}}}}],"relatedPermits":[],"disclosures":[{"code":"CONFIGURATION_AS_OF_DATE"},{"code":"ENERGOV_SOURCE_OF_TRUTH"},{"code":"ESTIMATE_NOT_INVOICE"},{"code":"HISTORICAL_OCCURRENCE_NOT_REQUIREMENT"},{"code":"INPUT_REQUIRED"},{"code":"MANUAL_REVIEW"},{"code":"UNSUPPORTED_RULE"}]}
