{"schemaVersion":"public-1.0","catalogVersion":"2026-10-14-field-history","configuration":{"asOfDate":"2026-10-14","historicalPeriod":{"startDate":"2019-07-01","endDate":"2026-09-15"}},"option":{"optionKey":"o143","permitTypeKey":"t027","permitType":"DSLC - Zoning Permit","workClassKey":"w080","workClass":"Retaining Wall"},"ui":{"controls":[{"key":"i001","label":"Type Of Work","displayLabel":"Type Of Work","valueType":"choice","controlType":"select","displayReady":true,"usages":["applicability"],"requiredForFeeIds":["f0001","f0002"],"choices":[{"value":"c001","label":"Non-Residential"},{"value":"c002","label":"Residential"}],"historicalPrevalence":{"status":"unavailable"},"presentationGroup":null,"choiceContextStatus":"available"}],"presentation":{"mode":"flat","groups":[]},"uiBlockers":[],"blockingRuntimeDiagnostics":[],"runtimeReady":true,"displayReady":true},"fees":[{"feeTemplateFeeId":"f0001","name":"DSINSP - Non-Residential Zoning Permit","section":"conditional","assessmentRole":"dependency-unresolved","applicability":{"status":"conditional","conditions":[{"kind":"expression","sourceRule":{"isOrGroup":false,"childConditions":[{"operatorID":1,"operandValue":"i001","compareExpression":{"value":"c001"}}],"childConditionGroups":[]}}]},"calculation":{"mode":"fixed","fixedAmount":278.0,"rule":{"amount":278.0,"minimum":0.0,"maximum":0.0,"roundingType":1,"roundingValue":0.0,"inputs":[]}}},{"feeTemplateFeeId":"f0002","name":"DSINSP - Residential Zoning Fee","section":"conditional","assessmentRole":"dependency-unresolved","applicability":{"status":"conditional","conditions":[{"kind":"expression","sourceRule":{"isOrGroup":false,"childConditions":[{"operatorID":1,"operandValue":"i001","compareExpression":{"value":"c002"}}],"childConditionGroups":[]}}]},"calculation":{"mode":"fixed","fixedAmount":261.0,"rule":{"amount":261.0,"minimum":0.0,"maximum":0.0,"roundingType":1,"roundingValue":0.0,"inputs":[]}}},{"feeTemplateFeeId":"f0003","name":"MISC - Technology Surcharge","section":"inactive","assessmentRole":"standalone-or-assessed","applicability":{"status":"inactive","conditions":[]},"calculation":{"mode":"unsupported","fixedAmount":null,"rule":{"amount":4.0,"minimum":0.0,"maximum":0.0,"roundingType":2,"roundingValue":1.0,"inputs":[],"publicBehavior":{"rateScale":0.01}}}},{"feeTemplateFeeId":"f0004","name":"MISC - Technology Surcharge","section":"input-required","assessmentRole":"standalone-or-assessed","applicability":{"status":"configured","conditions":[]},"calculation":{"mode":"input","fixedAmount":null,"rule":{"amount":4.0,"minimum":0.0,"maximum":0.0,"roundingType":2,"roundingValue":1.0,"inputs":[{"source":"fee","inputKey":"f0006"},{"source":"fee","inputKey":"f0010"},{"source":"fee","inputKey":"f0011"},{"source":"fee","inputKey":"f0013"},{"source":"fee","inputKey":"f0012"},{"source":"fee","inputKey":"f0020"},{"source":"fee","inputKey":"f0021"}],"publicBehavior":{"rateScale":0.01,"aggregate":"sum"}}}},{"feeTemplateFeeId":"f0005","name":"MISC - Technology Surcharge","section":"input-required","assessmentRole":"standalone-or-assessed","applicability":{"status":"configured","conditions":[]},"calculation":{"mode":"input","fixedAmount":null,"rule":{"amount":4.0,"minimum":0.0,"maximum":0.0,"roundingType":2,"roundingValue":1.0,"inputs":[{"source":"fee","inputKey":"f0001"},{"source":"fee","inputKey":"f0002"}],"publicBehavior":{"rateScale":0.01,"aggregate":"sum"}}}},{"feeTemplateFeeId":"f0006","name":"DSENG - Voiding Permit Fee - Engineering (ROW)","section":"manual-review","assessmentRole":"dependency-unresolved","applicability":{"status":"manual-review","conditions":[]},"calculation":{"mode":"manual","fixedAmount":null,"rule":{"amount":124.0,"minimum":0.0,"maximum":0.0,"roundingType":1,"roundingValue":0.0,"inputs":[]}},"disposition":"later-event"},{"feeTemplateFeeId":"f0007","name":"DSINSP -  Zoning Inspection Fee","section":"manual-review","assessmentRole":"standalone-or-assessed","applicability":{"status":"manual-review","conditions":[]},"calculation":{"mode":"manual","fixedAmount":null,"rule":{"amount":1.0,"minimum":0.0,"maximum":0.0,"roundingType":1,"roundingValue":0.0,"inputs":[]}}},{"feeTemplateFeeId":"f0008","name":"DSINSP - Non-Residential Zoning Permit","section":"manual-review","assessmentRole":"standalone-or-assessed","applicability":{"status":"manual-review","conditions":[]},"calculation":{"mode":"manual","fixedAmount":null,"rule":{"amount":278.0,"minimum":0.0,"maximum":0.0,"roundingType":1,"roundingValue":0.0,"inputs":[]}}},{"feeTemplateFeeId":"f0009","name":"DSINSP - Residential Zoning Fee","section":"manual-review","assessmentRole":"standalone-or-assessed","applicability":{"status":"manual-review","conditions":[]},"calculation":{"mode":"manual","fixedAmount":null,"rule":{"amount":261.0,"minimum":0.0,"maximum":0.0,"roundingType":1,"roundingValue":0.0,"inputs":[]}}},{"feeTemplateFeeId":"f0010","name":"DSINSP - Voiding Permit Fee - Building","section":"manual-review","assessmentRole":"dependency-unresolved","applicability":{"status":"manual-review","conditions":[]},"calculation":{"mode":"manual","fixedAmount":null,"rule":{"amount":124.0,"minimum":0.0,"maximum":0.0,"roundingType":1,"roundingValue":0.0,"inputs":[]}},"disposition":"later-event"},{"feeTemplateFeeId":"f0011","name":"DSINSP - Voiding Permit Fee - Electrical","section":"manual-review","assessmentRole":"dependency-unresolved","applicability":{"status":"manual-review","conditions":[]},"calculation":{"mode":"manual","fixedAmount":null,"rule":{"amount":124.0,"minimum":0.0,"maximum":0.0,"roundingType":1,"roundingValue":0.0,"inputs":[]}},"disposition":"later-event"},{"feeTemplateFeeId":"f0012","name":"DSINSP - Voiding Permit Fee - Plumbing","section":"manual-review","assessmentRole":"dependency-unresolved","applicability":{"status":"manual-review","conditions":[]},"calculation":{"mode":"manual","fixedAmount":null,"rule":{"amount":124.0,"minimum":0.0,"maximum":0.0,"roundingType":1,"roundingValue":0.0,"inputs":[]}},"disposition":"later-event"},{"feeTemplateFeeId":"f0013","name":"DSINSP - Voiding Permit Fee – Mechanical","section":"manual-review","assessmentRole":"dependency-unresolved","applicability":{"status":"manual-review","conditions":[]},"calculation":{"mode":"manual","fixedAmount":null,"rule":{"amount":124.0,"minimum":0.0,"maximum":0.0,"roundingType":1,"roundingValue":0.0,"inputs":[]}},"disposition":"later-event"},{"feeTemplateFeeId":"f0014","name":"ENG - Voiding Permit Fee - Stormwater","section":"manual-review","assessmentRole":"standalone-or-assessed","applicability":{"status":"manual-review","conditions":[]},"calculation":{"mode":"manual","fixedAmount":null,"rule":{"amount":124.0,"minimum":0.0,"maximum":0.0,"roundingType":1,"roundingValue":0.0,"inputs":[]}},"disposition":"later-event"},{"feeTemplateFeeId":"f0015","name":"FIRE - Voiding Permit Fee - Fire Alarm","section":"manual-review","assessmentRole":"standalone-or-assessed","applicability":{"status":"manual-review","conditions":[]},"calculation":{"mode":"manual","fixedAmount":null,"rule":{"amount":124.0,"minimum":0.0,"maximum":0.0,"roundingType":1,"roundingValue":0.0,"inputs":[]}},"disposition":"later-event"},{"feeTemplateFeeId":"f0016","name":"FIRE - Voiding Permit Fee - Fire Protection","section":"manual-review","assessmentRole":"standalone-or-assessed","applicability":{"status":"manual-review","conditions":[]},"calculation":{"mode":"manual","fixedAmount":null,"rule":{"amount":124.0,"minimum":0.0,"maximum":0.0,"roundingType":1,"roundingValue":0.0,"inputs":[]}},"disposition":"later-event"},{"feeTemplateFeeId":"f0017","name":"MISC - Technology Surcharge","section":"manual-review","assessmentRole":"standalone-or-assessed","applicability":{"status":"manual-review","conditions":[]},"calculation":{"mode":"manual","fixedAmount":null,"rule":{"amount":4.0,"minimum":0.0,"maximum":0.0,"roundingType":2,"roundingValue":1.0,"inputs":[],"publicBehavior":{"rateScale":0.01}}}},{"feeTemplateFeeId":"f0018","name":"PRCR - Voiding Permit Fee - Urban Forestry","section":"manual-review","assessmentRole":"standalone-or-assessed","applicability":{"status":"manual-review","conditions":[]},"calculation":{"mode":"manual","fixedAmount":null,"rule":{"amount":124.0,"minimum":0.0,"maximum":0.0,"roundingType":1,"roundingValue":0.0,"inputs":[]}},"disposition":"later-event"},{"feeTemplateFeeId":"f0019","name":"PU - Voiding Permit Fee - Stub","section":"manual-review","assessmentRole":"standalone-or-assessed","applicability":{"status":"manual-review","conditions":[]},"calculation":{"mode":"manual","fixedAmount":null,"rule":{"amount":124.0,"minimum":0.0,"maximum":0.0,"roundingType":1,"roundingValue":0.0,"inputs":[]}},"disposition":"later-event"},{"feeTemplateFeeId":"f0020","name":"ZP - Voiding Permit Fee - Zoning","section":"manual-review","assessmentRole":"dependency-unresolved","applicability":{"status":"manual-review","conditions":[]},"calculation":{"mode":"manual","fixedAmount":null,"rule":{"amount":124.0,"minimum":0.0,"maximum":0.0,"roundingType":1,"roundingValue":0.0,"inputs":[]}},"disposition":"later-event"},{"feeTemplateFeeId":"f0021","name":"ZP- Voiding Permit Fee (Zoning - Sign)","section":"manual-review","assessmentRole":"dependency-unresolved","applicability":{"status":"manual-review","conditions":[]},"calculation":{"mode":"manual","fixedAmount":null,"rule":{"amount":124.0,"minimum":0.0,"maximum":0.0,"roundingType":1,"roundingValue":0.0,"inputs":[]}},"disposition":"later-event"}],"relatedPermits":[],"disclosures":[{"code":"CONFIGURATION_AS_OF_DATE"},{"code":"ENERGOV_SOURCE_OF_TRUTH"},{"code":"ESTIMATE_NOT_INVOICE"},{"code":"INPUT_REQUIRED"},{"code":"MANUAL_REVIEW"},{"code":"UNSUPPORTED_RULE"}]}
