{"schemaVersion":"public-1.0","catalogVersion":"2026-10-14-internal-r1","configuration":{"asOfDate":"2026-10-14","historicalPeriod":{"startDate":"2019-07-01","endDate":"2026-09-15"}},"option":{"optionKey":"o127","permitTypeKey":"t026","permitType":"DSINSP - Typical Construction Drawings","workClassKey":"w064","workClass":"Accessory Dwelling Unit (ADU) Typical"},"ui":{"controls":[],"presentation":{"mode":"flat","groups":[]},"uiBlockers":[],"blockingRuntimeDiagnostics":[],"runtimeReady":true,"displayReady":true},"fees":[],"relatedPermits":[],"disclosures":[{"code":"CONFIGURATION_AS_OF_DATE"},{"code":"ENERGOV_SOURCE_OF_TRUTH"},{"code":"ESTIMATE_NOT_INVOICE"},{"code":"HISTORICAL_OCCURRENCE_NOT_REQUIREMENT"},{"code":"LOW_SAMPLE"}]}
