{"schemaVersion":"public-1.0","catalogVersion":"2026-10-14-internal-r1","configuration":{"asOfDate":"2026-10-14","historicalPeriod":{"startDate":"2019-07-01","endDate":"2026-09-15"}},"option":{"optionKey":"o130","permitTypeKey":"t027","permitType":"DSLC - Zoning Permit","workClassKey":"w067","workClass":"Amplified Entertainment"},"ui":{"controls":[],"presentation":{"mode":"flat","groups":[]},"uiBlockers":[],"blockingRuntimeDiagnostics":[],"runtimeReady":true,"displayReady":true},"fees":[{"feeTemplateFeeId":"f0001","name":"FIRE - Reinspection Fee","section":"event-contingent","assessmentRole":"standalone-or-assessed","applicability":{"status":"event-contingent","conditions":[{"kind":"expression","sourceRule":{"isOrGroup":false,"childConditions":[{"operatorID":1,"operandValue":"x001","compareExpression":{"value":"c001"}}],"childConditionGroups":[]}},{"kind":"inspection"}]},"calculation":{"mode":"fixed","fixedAmount":122.0,"rule":{"amount":122.0,"minimum":0.0,"maximum":0.0,"roundingType":1,"roundingValue":0.0,"inputs":[]}},"disposition":"later-event"}],"relatedPermits":[],"disclosures":[{"code":"CONFIGURATION_AS_OF_DATE"},{"code":"ENERGOV_SOURCE_OF_TRUTH"},{"code":"ESTIMATE_NOT_INVOICE"},{"code":"EVENT_CONTINGENT"},{"code":"HISTORICAL_OCCURRENCE_NOT_REQUIREMENT"},{"code":"REPEATABLE_FEE"},{"code":"UNSUPPORTED_RULE"}]}
